File Name,Title,Primary Creator Last Name,Primary Creator First Name,,Section,"Title of the objectA name given to the resource. Examples: title of a painting, photo, video.","An entity primarily responsible for making the resource. Examples: Author/authors; artists; photographers; institutional authors or producers, such as university or federal agency.",,,://:MONOGRAPH://:,The Tempest; A Subtitle, Shakespeare,William,,://:MONOGRAPH://:shipwreck.jpg,"The shipwreck scene in Act I, Scene 1",Smith,,,miranda.jpg,Miranda,Waterhouse,John William,,